Expand All | Collapse All,YEAR,AMOUNT,LENDER,BORROWER,SECTOR,SENSITIVE TERRITORY OVERLAP,Country
Rahim Yar Khan Coal Fired Plant,2016,$956M,ExImBank,Nishat Energy Limited (NEL),Power,None Known,Pakistan
Rail cars for Roca Commuter Line,2019,$236M,CDB,Government,Transport,None Known,Argentina
"Railroad Electrification (between Tehran, Qom and Isfahan)",2017,$1.5B,ExImBank,Islamic Republic of Iran Railways (IRIR),Transport,"Within Indigenous Peoples' Lands
 Within Critical Habitats",Iran
Railway Bridge across Amur River,2013,$97M,ExImBank,Government,Transport,None Known,Russian Federation
Railway Rolling Stock Purchase,2011,$86M,ExImBank,Government,Transport,None Known,Angola
Rajshahi Surface Water Treatment Plant Project,2014,$500M,ExImBank,Government,Government,None Known,Bangladesh
Ranomafana Hydropower Plant Project,2018,$197M,ExImBank,Government,Power,Within Critical Habitats,Madagascar
Reconstruction of the Zhlobin-Gomel section of M-5/E 271 Minsk-Gomel highway,2011,$340M,ExImBank,Government,Transport,None Known,Belarus
Rehabiitation & Improvement of Puttalam-Marichchikade-Mannar Road,2011,$73M,ExImBank,Government,Transport,"Within Critical Habitats
 Within National Protected Areas",Sri Lanka
Rehabilitation and Improvement of Navatkuli-Karaitivu-Mannar Road,2011,$48M,ExImBank,Government,Transport,"Within Critical Habitats
 Within National Protected Areas",Sri Lanka
Rehabilitation and Improvement of Priority Road Project,2010,$153M,CDB,Government,Transport,None Known,Sri Lanka
Rehabilitation and Improvement of Priority Road Project,2011,$500M,CDB,Government,Transport,None Known,Sri Lanka
Rehabilitation and Improvement of Priority Road Project 3 Phase I,2014,$300M,CDB,Government,Transport,None Known,Sri Lanka
Rehabilitation and Improvement of Priority Road Project 3 Phase II,2014,$100M,CDB,Government,Transport,None Known,Sri Lanka
Rehabilitation And Upgrading Of Equipment In The Universities And Technical Training Institutes Project,2011,$31M,ExImBank,Government,Government,None Known,Kenya
Rehabilitation of 500-kilowatt Power Transmission Line,2017,$79M,ExImBank,Government,Power,None Known,Tajikistan
Rehabilitation of Belgrano Cargas railway,2014,$2.1B,"CDB, ICBC",Government,Transport,"Within Indigenous Peoples' Lands
 Within Critical Habitats",Argentina
Rehabilitation of Cambodia National Road No.62,2010,$54M,ExImBank,Government,Transport,"Within Indigenous Peoples' Lands
 Within Critical Habitats
 Within National Protected Areas",Cambodia
Rehabilitation of Five Roads (Luanda Province),2016,$51M,CDB,Government,Transport,None Known,Angola
Rehabilitation of National Road 62 & National Road 210,2008,$58M,ExImBank,Government,Transport,"Within Indigenous Peoples' Lands
 Within Critical Habitats
 Within National Protected Areas",Cambodia
Rehabilitation of Sam Lord’s Castle Hotel,2015,$170M,ExImBank,Barbados Tourism Investment (BTI),Other construction,None Known,Barbados
Rehabilitation Project of the National Road No 57B,2009,$92M,ExImBank,Government,Transport,Within Critical Habitats,Cambodia
Reinforcement of Existing Water System 3 (Kikuxi),2016,$124M,CDB,Government,Government,None Known,Angola
Rembang Power Station,2008,$131M,CDB,Perusahaan Listrik Negara (PLN),Power,None Known,Indonesia
Replacement of 1500 cars,2011,$25M,ExImBank,Government,Transport,None Known,Angola
Revamping Argentina's train system,2010,$10.0B,"CDB, others",Government,Transport,None Known,Argentina
Revamping Minsk CHP Plant No. 5,2008,$260M,CDB,Government,Power,None Known,Belarus
RN2 Construction (crossing to Butembo),2015,$33M,ExImBank,Government,Transport,Within Critical Habitats,"Congo, Democratic Republic of the"
RN5 National Road Asphalting (Phase I),2008,$88M,ExImBank,Government,Transport,"Within Indigenous Peoples' Lands
 Within Critical Habitats
 Within National Protected Areas","Congo, Democratic Republic of the"
RN5 National Road Grading (Phase I),2008,$51M,ExImBank,Government,Transport,"Within Indigenous Peoples' Lands
 Within Critical Habitats
 Within National Protected Areas","Congo, Democratic Republic of the"
Road and bridge rehabilitation projects,2013,$300M,ExImBank,Government,Transport,None Known,Jamaica
Road Construction (Farasol Mbega to Port-Gentil),2016,$103M,ExImBank,Government,Transport,Within Critical Habitats,Gabon
Road Construction (from Blaise-Diagne International Airport),2015,$331M,ExImBank,Government,Transport,Within National Protected Areas,Senegal
Road network,2016,$327M,ExImBank,Government,Transport,None Known,Jamaica
Road Reconstruction,2014,$57M,ExImBank,Government,Transport,Within Critical Habitats,Vanuatu
Road Rehabilitation (Cuanza Norte),2016,$29M,CDB,Government,Transport,None Known,Angola
"Road Rehabilitation (Cuito, Bie)",2016,$29M,CDB,Government,Transport,None Known,Angola
Road Rehabilitation (Malanje),2016,$27M,CDB,Government,Transport,None Known,Angola
Road Rehabilitation (Malanje),2016,$25M,CDB,Government,Transport,None Known,Angola
Road Rehabilitation (Uige),2016,$50M,CDB,Government,Transport,Within Critical Habitats,Angola
Road rehabilitation and upgrade project Phase 2,2018,$50M,ExImBank,Government,Transport,None Known,Vanuatu
Road Upgrading Project Nabouwalu Dreketi,2012,$840M,ExImBank,Government,Transport,"Within Critical Habitats
 Within National Protected Areas",Fiji
Roads Improvement Sigatoka-Serea,2014,$328M,ExImBank,Government,Transport,"Within Critical Habitats
 Within National Protected Areas",Fiji
Roberts International Airport Rehabilitation,2017,$50M,ExImBank,Government,Transport,None Known,Liberia
Rockwell-Estrella Bridge,2016,$85M,ExImBank,Government,fTransport,None Known,Philippines
Rositas Hydroelectric Power Plant,2016,$1000M,ExImBank,ENDE,Power,"Within Critical Habitats
 Within National Protected Areas",Bolivia
Rua 12 de Julho Road Work (Sambizanga),2016,$46M,CDB,Government,Transport,None Known,Angola
Rural Base Stations Construction - 250 Units,2017,$71M,ExImBank,NetOne,Telecom,None Known,Zimbabwe
Rural Power Grid Extension Project Phase 1,2009,$54M,ExImBank,Government,Power,None Known,Cambodia
Rural Power Grid Extension Project Phase 2,2014,$90M,ExImBank,Government,Power,None Known,Cambodia
Rural Power Grid Extension Project Phase 3 and 4,2014,$90M,ExImBank,Government,Power,None Known,Cambodia
Rural Power Grid Extension Project Phase 5 and 6,2016,$100M,ExImBank,Government,Power,None Known,Cambodia
Rurrenabaque-Riberalta roadway,2015,$600M,ExImBank,Government,Transport,"Within Indigenous Peoples' Lands
 Within Critical Habitats
 Within National Protected Areas",Bolivia
Russia-China Oil Pipeline,2009,$10.0B,CDB,Transneft,"Extraction, pipelines",None Known,Russian Federation
Salavan-Sekong II Power Transmission Project,2016,$377M,ExImBank,Government,Power,"Within Indigenous Peoples' Lands
 Within Critical Habitats
 Within National Protected Areas",Laos
San José - Limón highway,2015,$395M,ExImBank,Government,Transport,"Within Critical Habitats
 Within National Protected Areas",Costa Rica
San Martin freight railway upgrading,2018,$1.1B,ExImBank,Government,Transport,"Within Indigenous Peoples' Lands
 Within Critical Habitats",Argentina
Santiago de Cuba port,2015,$120M,ExImBank,Government,Transport,None Known,Cuba
Sanza Pombo Farm,2012,$129M,CDB,Government,"Agriculture, food",None Known,Angola
Satellite communication system,2011,$282M,ExImBank,Government,Telecom,None Known,Belarus
Saurimo's Airport Aerogare Construction,2010,$28M,ExImBank,Government,Transport,None Known,Angola
Sberbank Modernization of Eurocement,2015,$966M,CDB,Sberbank of Russia,Manufacturing,None Known,Russian Federation
Sennar Bridge Construction,2010,$59M,ExImBank,Government,Transport,None Known,Sudan
SGR (Phase II: Nairobi to Malaba) - Sub-phase 1; Nairobi to Naivasha Section,2015,$1.5B,ExImBank,Government,Transport,"Within Critical Habitats
 Within National Protected Areas",Kenya
SGR Phase I - Mombasa to Nairobi (CL portion; Total= $3.6bn),2014,$1.6B,ExImBank,Government,Transport,"Within Critical Habitats
 Within National Protected Areas",Kenya
SGR Phase I - Mombasa to Nairobi (Commercial Loan portion; Total= $3.6bn),2014,$2.0B,ExImBank,Government,Transport,"Within Critical Habitats
 Within National Protected Areas",Kenya
Ships Purchase,2011,$235M,ExImBank,Ethiopian Shipping Lines,Transport,None Known,Ethiopia
Sicomine Copper Mining Project,2008,$429M,ExImBank,Sicomine,"Extraction, pipelines",None Known,"Congo, Democratic Republic of the"
"Siem Reap New International Airport, Siem Reap",2013,$880M,"CDB, ExImBank",Government,Transport,None Known,Cambodia
Simón Bolívar highway,2013,$80M,ExImBank,Government,Transport,Within Critical Habitats,Ecuador
Single point mooring with double pipelines,2016,$542M,ExImBank,Bangladesh Petroleum Corporation,"Extraction, pipelines",Within Critical Habitats,Bangladesh
Sino-Myanmar Pipeline,2009,$2.4B,CDB,Government,Power,"Within Indigenous Peoples' Lands
 Within Critical Habitats
 Within National Protected Areas",Myanmar
Sir Seewoosagur Ramgoolam International Airport,2009,$260M,ExImBank,Government,Transport,Within Critical Habitats,Mauritius
Slavkali Potash mine,2016,$1.4B,CDB,Belarusbank,"Extraction, pipelines",None Known,Belarus
Smart Zambia National ICT Development (Phase I),2015,$66M,ExImBank,Government,Telecom,None Known,Zambia
SME development,2017,$150M,CDB,BICE,Government,None Known,Argentina
SME Loans,2015,$143M,CDB,Central Bank of Kenya,Government,None Known,Kenya
SMEs,2014,$60M,CDB,Trade and Development Bank,Government,None Known,Regional
SMEs,2013,$41M,CDB,Development Bank of Central Africa,Government,None Known,Regional
SMEs,2016,$42M,CDB,Development Bank of Central Africa,Government,None Known,Regional
SMEs Development Loan,2013,$25M,CDB,Development Bank of Ethiopia,Government,None Known,Ethiopia
SMEs Development Loan,2015,$30M,CDB,Development Bank of Zambia,Government,None Known,Zambia
SMEs in the agricultural sector within UEMOA zone,2011,$78M,CDB,Banque Ouest Africaine,"Agriculture, food",None Known,Regional
SMEs Loan,2015,$100M,CDB,National Bank of Egypt,Government,None Known,Egypt
SMEs Loan,2016,$100M,CDB,Banque Misr,Government,None Known,Egypt
SMEs Loan,2012,$25M,CDB,Ethiopia Development Bank,Government,None Known,Ethiopia
SMEs Loan,2011,$30M,CDB,Millennium BIM,Government,None Known,Mozambique
"SMEs Loan (Agriculture, Environment and Communications)",2012,$200M,CDB,National Bank of Egypt,Government,None Known,Egypt
Social Housing Construction,2011,$75M,ExImBank,Government,Government,None Known,Cameroon
Sokode Electric Transformer Station Project,2013,$25M,ExImBank,Government,Power,None Known,Togo
Solar-Powered Milling Plants,2016,$170M,CDB,Zambia Cooperative Federation,"Agriculture, food",None Known,Zambia
Solo-Kertosono Toll Road Project,2014,$200M,ExImBank,Government,Transport,None Known,Indonesia
Sonangol Development,2014,$2.0B,CDB,Sonangol,"Extraction, pipelines",None Known,Angola
Sonangol Development,2011,$2.0B,CDB,Sonangol,"Extraction, pipelines",None Known,Angola
Sonangol Development,2012,$1000M,CDB,Sonangol Finance Ltd.,"Extraction, pipelines",None Known,Angola
Sonangol Development,2013,$2.5B,CDB,Sonangol,"Extraction, pipelines",None Known,Angola
Sonangol Recapitalization,2016,$10.0B,CDB,Government,"Extraction, pipelines",None Known,Angola
Sopladora Hydroelectric Dam,2010,$571M,ExImBank,Government,Power,None Known,Ecuador
SORAZ-Zinder et Maradi-Malbaza Transmission Line Construction (132kV),2013,$76M,ExImBank,Government,Power,None Known,Niger
SOTELGUI National Telecom Project,2014,$50M,ExImBank,Government,Telecom,None Known,Guinea
Souapiti Hydropower Project (450MW),2018,$599M,ExImBank,Souapiti Hydropower SPV,Power,None Known,Guinea
Soubre Hydropower Project (275MW),2013,$500M,ExImBank,Government,Power,None Known,Cote d'Ivoire
South Atlantic Inter Link (SAIL) Project,2015,$85M,ExImBank,Government,Telecom,Within Critical Habitats,Cameroon
South Kordofan Transmission Lines,2010,$233M,ExImBank,Government,Power,None Known,Sudan
South Kordofan Um Rawaba- Abu Gibeha Ring Road / 141 Road / Aum Roaba - Abu Gebaha Road Construction,2009,$63M,ExImBank,Government,Transport,None Known,Sudan
Southern Expressway Extension- Section 4 from Mattala to Hambantota,2014,$412M,ExImBank,Government,Transport,"Within Critical Habitats
 Within National Protected Areas",Sri Lanka
Southern Luzon Railway,2016,$2.0B,ExImBank,Government,Transport,None Known,Philippines
Soy processing industrial line,2015,$1.2B,CDB,Government,"Agriculture, food",None Known,Brazil
Soyo City River and Land Terminal Construction,2016,$60M,CDB,Government,Transport,Within Critical Habitats,Angola
Soyo-Kapary Transmission and Transformation Project,2013,$118M,ExImBank,Government,Power,None Known,Angola
St John Port,2016,$90M,ExImBank,Government,Transport,None Known,Antigua & Barbuda
Staung River Basin Water Resources Development Project Phase I,2013,$330M,ExImBank,Government,Government,None Known,Cambodia
STELCO 5th Power Development,2016,$75M,ExImBank,State Electric Company,Power,Within Critical Habitats,Maldives
Student dormitory of Goroka University,2011,$42M,ExImBank,Government,Government,None Known,Papua New Guinea
Stung Tatay Hydropower Project Main Project,2010,$540M,ExImBank,Government,Power,"Within Indigenous Peoples' Lands
 Within Critical Habitats
 Within National Protected Areas",Cambodia
Subic-Clark Railway Project,2016,$995M,ExImBank,Government,Transport,Within Critical Habitats,Philippines
Sumbe City infrastructure Lot 1 (Stabalizing Slopes and Relocation),2017,$158M,CDB,Government,Transport,None Known,Angola
Sumbe City Infrastructure Lot 2 (Drainage),2017,$106M,CDB,Government,Government,None Known,Angola
Sumbe City Infrastructure Lot 3 (Road Construction),2017,$112M,CDB,Government,Transport,None Known,Angola
Sumsel (SS-5) Power Station,2013,$318M,CDB,Government,Power,None Known,Indonesia
"Supply Contract to CNOOC, Zhenhua and CNPC",2016,$5.0B,CDB,Petrobras,"Extraction, pipelines",None Known,Brazil
Supply of Two Nos.MA60 Aircraft Project,2010,$41M,ExImBank,Government,Transport,None Known,Sri Lanka
Suralaya Unit 8 Power Plant,2009,$280M,ExImBank,Perusahaan Listrik Negara (PLN),Power,None Known,Indonesia
Surcin - Obrenovac Highway,2017,$198M,ExImBank,Government,Transport,None Known,Serbia
Takalar Steam Coal-Fired Power Plant (200MW),2014,$241M,ExImBank,Indonesian State Electricity Company,Power,None Known,Indonesia
Takoradi Port Expansion (Phase I) - Access Road,2011,$150M,CDB,Government,Transport,Within Critical Habitats,Ghana
Tanjung Kasam Power Station with Sinosure,2014,$150M,ExImBank,Government,Power,Within Critical Habitats,Indonesia
Taoussa Hydropower Plant,2011,$100M,ExImBank,Government,Power,Within Indigenous Peoples' Lands,Mali
Taunsa hydro electric project,2011,$377M,ExImBank,Government of Punjab,Power,None Known,Pakistan
Tavan Tolgoi coal railway,2016,$1.3B,ExImBank,Mongolia,"Extraction, pipelines","Within Critical Habitats
 Within National Protected Areas",Mongolia
Telecommunications Infrastructure Construction,2010,$32M,ExImBank,Government,Telecom,None Known,Comoros
TelOne related Project,2015,$99M,ExImBank,TelOne,Telecom,None Known,Zimbabwe
Teluk Sirih Coal-Fired Power Plant (224MW),2013,$138M,CDB,Perusahaan Listrik Negara (PLN),Power,"Within Indigenous Peoples' Lands
 Within Critical Habitats",Indonesia
Thai Binh 2 Coal Power Plant,2013,$28M,CDB,Petrovietnam,Power,None Known,Vietnam
Thakot - Raikot Karakoram Highway (Upgrade),2017,$76M,ExImBank,Government,Transport,"Within Indigenous Peoples' Lands
 Within Critical Habitats
 Within National Protected Areas",Pakistan
Thalpitigala Resovoir Dam,2018,$148M,ExImBank,Government,Power,None Known,Sri Lanka
Thar Block II Power Plant (Thar Engro),2015,$207M,CDB,Sindh Engro Coal Mining Company,Power,Within Indigenous Peoples' Lands,Pakistan
The enlargement of Cambodian National Road No. 6,2013,$242M,ExImBank,Government,Transport,"Within Indigenous Peoples' Lands
 Within Critical Habitats",Cambodia
Thies-Touba Toll Highway Construction,2015,$689M,ExImBank,Government,Transport,Within Indigenous Peoples' Lands,Senegal
Third Unit of Ekibastuz GRES-2 Power Plant with Russia,2013,$400M,CDB,Government,Power,None Known,Kazakhstan
Tiébissou-Bouaké Highway Construction,2018,$69M,ExImBank,Government,Transport,Within Critical Habitats,Cote d'Ivoire
Tier-4 Data Center,2015,$154M,ExImBank,Government,Telecom,None Known,Bangladesh
Togolese Road Network (partial) Renovation,2009,$165M,ExImBank,Government,Transport,"Within Indigenous Peoples' Lands
 Within National Protected Areas",Togo
Tonga High school Sports Complex for 2019 Pacific Games,2017,$57M,ExImBank,Government,Other construction,None Known,Tonga
Trade and Project Finance Line of Credit,2009,$100M,ExImBank,African Export Import Bank,Government,None Known,Regional
"Trade finance: 20 high-speed trains, 200 passenger cars, service and parts",2010,$273M,"CDB, Citic",Government,Transport,None Known,Argentina
"Trade finance: wine, fruit, food, pharmaceuticals, machinery, also renewable energy projects (renewal of 2007 loan)",2010,$30M,CDB,BICE,Mulit-sector/discretionary,None Known,Argentina
Trade support,2017,$300M,ExImBank,Bank of Brazil,Mulit-sector/discretionary,None Known,Brazil
Trade support: 40 E-195 aircrafts,2015,$1.3B,ExImBank,BNDES,Transport,None Known,Brazil
Trade support: Chinese buses,2012,$100M,ExImBank,Government,Transport,None Known,Bolivia
Trade support: Chinese helicopters,2011,$300M,CDB,Government,Transport,None Known,Bolivia
Trade support: Chinese satellite,2010,$251M,CDB,Government,Telecom,None Known,Bolivia
Trade support: oil-related goods,2012,$500M,CDB,"Petróleos de Venezuela, S.A. (PDVSA)",Power,None Known,Venezuela
Trade: vessels and offshore oilfield equipment,2013,$1000M,ExImBank,PEMEX,"Extraction, pipelines",None Known,Mexico
Trains Purchase,2009,$80M,ExImBank,Tunisian National Railways Company,Transport,None Known,Tunisia
Transmission Capacity Upgrade,2013,$500M,ExImBank,Government,Power,None Known,Nigeria
Transmission Lines from Imboulou Hydropower: 220kV; 110kV; 30kV; 20kV,2009,$264M,ExImBank,Government,Power,"Within Indigenous Peoples' Lands
 Within Critical Habitats
 Within National Protected Areas","Congo, Republic of the"
Transnet Locomotive Purchases (1st Disbursement),2016,$464M,CDB,Transnet,Transport,None Known,South Africa
Transnet Locomotive Purchases (partial 2nd disbursement),2017,$667M,CDB,Transnet,Transport,None Known,South Africa
Trishuli-3A project,2011,$152M,ExImBank,Nepal Electricity Authority,Power,"Within Indigenous Peoples' Lands
 Within Critical Habitats",Nepal
Tuzla 7 Lignite Power Plant,2011,$882M,ExImBank,Elektroprivreda BiH,Power,None Known,Bosnia & Herzegovina
Umm Kaddada Alfashir Road Construction,2009,$86M,ExImBank,Government,Transport,None Known,Sudan
Unified power system,2011,$27M,ExImBank,Government,Power,None Known,Tajikistan
University of Ghana Legon ICT-Enabled Distance Learning System project (Phase II),2012,$32M,ExImBank,Government,Government,None Known,Ghana
Unspecified,2009,$500M,ExImBank,,Mulit-sector/discretionary,None Known,Venezuela
Unspecified culture & infrastructure projects,2015,$200M,CDB,Bank for Investment and Development of Vietnam,Mulit-sector/discretionary,None Known,Vietnam
Uong Bi Power Plant,2009,$179M,ExImBank,Government,Power,None Known,Vietnam
Upgrade of RN5,2015,$80M,ExImBank,Government,Transport,"Within Indigenous Peoples' Lands
 Within Critical Habitats
 Within National Protected Areas","Congo, Democratic Republic of the"
Upgrade of Three Hydro Power Plants,2017,$240M,ExImBank,Government,Power,None Known,Uzbekistan
Upgrading Luanda MT/BT Networks (Phase III),2008,$26M,ExImBank,Government,Power,None Known,Angola
Upgrading Luanda MT/BT Networks (Phase IV),2008,$144M,ExImBank,Government,Power,None Known,Angola
Upgrading MT/BT Networks - Lunda-Norte and Lunda-Sul (Dundo & Saurimo),2008,$46M,ExImBank,Government,Power,None Known,Angola
Upgrading Vientiane's Wattay International Airport,2011,$38M,ExImBank,Government,Transport,None Known,Laos
Upper Trishuli III Dam,2011,$200M,ExImBank,Government,Power,"Within Indigenous Peoples' Lands
 Within Critical Habitats",Nepal
Upper Yeywa Power Transmission and Transformation EPC Project,2013,$180M,ExImBank,Government,Power,None Known,Myanmar
V.C Bird International Airport Terminal Project,2010,$38M,ExImBank,Government,Transport,None Known,Antigua & Barbuda
Vahdat-Javan railway section upgrade,2014,$57M,ExImBank,Government,Transport,None Known,Tajikistan
Vaico Irrigation Project,2013,$100M,ExImBank,Government,Government,None Known,Cambodia
Vanuatu E-Government,2008,$29M,ExImBank,Government,Telecom,None Known,Vanuatu
Various Machinery Supply (Phase I),2011,$100M,ExImBank,Government,Mulit-sector/discretionary,None Known,Eritrea
Various Machinery Supply (Phase II),2012,$62M,ExImBank,Government,Mulit-sector/discretionary,None Known,Eritrea
Various Machinery Supply (Phase III),2015,$96M,ExImBank,Government,Mulit-sector/discretionary,None Known,Eritrea
Various Renewable Energy Projects; Renewal of 2007/2010 Loans,2012,$200M,CDB,Government,Power,None Known,Argentina
VEB Development of Blockchain Technologies,2017,$882M,CDB,Vnesheconombank,Telecom,None Known,Russian Federation
Victoria Falls Airport Renovation,2012,$164M,ExImBank,Government,Transport,"Within Critical Habitats
 Within National Protected Areas",Zimbabwe
Villonaco Wind Farm,2011,$38M,CDB,Petroecuador,Power,None Known,Ecuador
Vinh Tan 1 Coal-Fired Thermal Power Plant,2014,$1.2B,"CDB, ExImBank","China Power International Development Limited Company (possible supplier's credit？), Power Corporation (Vietnam National Coal-Natural Industries Corporation)",Power,"Within Critical Habitats
 Within National Protected Areas",Vietnam
Vinh Tan 2 Power Plant,2010,$300M,ExImBank,Vietnam Electricity (EVN),Power,"Within Critical Habitats
 Within National Protected Areas",Vietnam
"Vinh Tan Coal Fired Power Plant III Unit I, II, III",2015,$200M,ExImBank,Government,Power,"Within Critical Habitats
 Within National Protected Areas",Vietnam
Vitebsk Hydropower Plant,2011,$189M,CDB,Government,Power,None Known,Belarus
Vnesheconombank corporate loan,2015,$1.6B,CDB,Vnesheconombank,Government,None Known,Russian Federation
Vung Ang Power Station,2011,$673M,CDB,Petrovietnam,Power,None Known,Vietnam
Water Supply System (Lunda-Norte and Lunda-Sul),2011,$25M,ExImBank,Government,Government,None Known,Angola
"Water Supply System Construction (Cuito, Bié)",2016,$39M,CDB,Government,Government,None Known,Angola
Water Supply System Construction (Luanda),2016,$51M,CDB,Government,Government,Within Critical Habitats,Angola
Water Supply System Construction (M'Banza Congo),2016,$30M,CDB,Government,Government,None Known,Angola
Water Supply System Construction (Malanje City),2016,$31M,CDB,Government,Government,None Known,Angola
"Water Supply System Construction (Muxaluando, Bengo)",2016,$41M,CDB,Government,Government,None Known,Angola
Water Supply System Construction- Part Two (Cabinda),2016,$76M,CDB,Government,Government,None Known,Angola
"Water Supply System Construction(Ecunha, Huambo)",2016,$33M,CDB,Government,Government,Within Critical Habitats,Angola
Water Supply System Part One Construction (Cabinda),2016,$76M,CDB,Government,Government,Within Critical Habitats,Angola
Water Supply Systems in Catete and Uíge Rehabilitation and Reinforcement (Phase II),2011,$30M,ExImBank,Government,Government,None Known,Angola
Water Supply Systems Rehabilitation,2011,$31M,ExImBank,Government,Government,None Known,Angola
Welkait Sugar Mill Construction,2014,$500M,ExImBank,Commercial Bank of Ethiopia,"Agriculture, food",Within Critical Habitats,Ethiopia
West Seti Hydropower Project (Chinese Covering 75% of the Cost),2015,$1.4B,ExImBank,Nepal Electricity Authority,Power,Within Indigenous Peoples' Lands,Nepal
West Side of the Lae Tidal Basin and Huon Industrial Park,2016,$109M,ExImBank,Government,Other construction,Within Critical Habitats,Papua New Guinea
Western Corridor Gas Infrastructure Project (Jubilee Oil Field),2013,$850M,CDB,Government,"Extraction, pipelines",None Known,Ghana
Working capital loan,2017,$250M,ExImBank,Trade and Development Bank,Government,None Known,Regional
Working capital loan,2018,$200M,ExImBank,Africa Finance Corporation,Government,None Known,Regional
Working capital loan,2018,$100M,ExImBank,Africa Finance Corporation,Government,None Known,Regional
Xeset III Hydropower Project,2014,$51M,ExImBank,Government,Power,Within Indigenous Peoples' Lands,Laos
Yachay Knowledge City,2016,$198M,ExImBank,Government,Mulit-sector/discretionary,None Known,Ecuador
Yaounde Potable Water Supply,2015,$678M,ExImBank,Government,Government,Within Critical Habitats,Cameroon
Yaoundé-Douala Highway Construction (Phase I),2012,$483M,ExImBank,Government,Transport,Within Critical Habitats,Cameroon
Z-9 Helicopters Purchase,2010,$105M,ExImBank,Government,Government,None Known,Zambia
Zalingei-El Geneinah Road Construction,2009,$120M,ExImBank,Government,Transport,None Known,Sudan
Zanzibar Airport Terminal 2 Expansion,2010,$73M,ExImBank,Government,Transport,None Known,Tanzania
Zemun-Borca bridge,2009,$217M,ExImBank,Government,Transport,None Known,Serbia
Zongo II Hydropower Station,2011,$367M,ExImBank,Government,Power,None Known,"Congo, Democratic Republic of the"
Zungeru Hydropower Plant Project,2013,$984M,ExImBank,Government,Power,Within Indigenous Peoples' Lands,Nigeria
