Expand All | Collapse All,YEAR,AMOUNT,LENDER,BORROWER,SECTOR,SENSITIVE TERRITORY OVERLAP,Country
Lotus Tower,2012,$89M,ExImBank,Telecommunications Regulatory Commission,Telecom,None Known,Sri Lanka
Low Cost Housing Project,2011,$139M,ExImBank,Government,Government,Within Critical Habitats,Fiji
Lower Stung Russey Chrum/Orussei Hydropower Project,2013,$412M,ExImBank,Government,Power,"Within Indigenous Peoples' Lands
 Within Critical Habitats
 Within National Protected Areas",Cambodia
Loznica Thermal Power Station,2016,$230M,CDB,CNEEC and Scarborough Group International,Power,None Known,Serbia
Luanda Rehabilitation of EN100 (part 1),2016,$34M,CDB,Government,Transport,Within Critical Habitats,Angola
Luanda-Soyo Highway; Nzeto-Soyo section (Package 7),2011,$46M,ExImBank,Government,Transport,Within Critical Habitats,Angola
Luanda/Soyo Highway Construction (Bridge over M'Bridge River),2011,$53M,ExImBank,Government,Transport,Within Critical Habitats,Angola
Luanda/Soyo Highway Construction (infrastructure work for Nzeto/Soyo section),2011,$85M,ExImBank,Government,Transport,Within Critical Habitats,Angola
Luanda/Soyo Highway Construction (Package 5),2011,$46M,ExImBank,Government,Transport,Within Critical Habitats,Angola
Luanda/Soyo Highway Construction (Package 6),2011,$46M,ExImBank,Government,Transport,Within Critical Habitats,Angola
Luganville Wharf Redevelopment,2015,$500M,ExImBank,Shanghai Construction Group,Transport,Within Critical Habitats,Vanuatu
Lunda Sul and Norte- Dundo and Saurimo Water Systems,2008,$32M,CDB,Government,Government,None Known,Angola
Lunda-Sul Road Rehabilitation (Xinge-Lubalo Connection),2016,$48M,CDB,Government,Transport,None Known,Angola
Lusaka International Airport,2014,$360M,ExImBank,Government,Transport,None Known,Zambia
Lusaka National Stadium Construction,2010,$86M,ExImBank,Government,Other construction,None Known,Zambia
Lusaka Urban Road L400 Construction (Phase I),2013,$296M,ExImBank,Government,Transport,Within National Protected Areas,Zambia
Lusaka Urban Road L400 Construction (Phase II),2016,$313M,ExImBank,Government,Transport,None Known,Zambia
Lusaka Urban Roads (L400) Upgrade; 400km (Phase III)-Eximbank part,2018,$205M,ExImBank,Government,Transport,Within National Protected Areas,Zambia
Lusaka-Kafue Bulk Water Supply Project,2016,$128M,ExImBank,Government,Government,None Known,Zambia
Lusiwasi Lower Hydropower Expansion & Lunzua Hydropower Rehabilitation,2013,$183M,ExImBank,Zambia Electricity Supply Corporation Limited (ZESCO),Power,Within National Protected Areas,Zambia
Lwambo-Mitwaba-Manono-Kalemie Road Asphalting (Phase I),2013,$35M,ExImBank,Government,Transport,"Within Indigenous Peoples' Lands
 Within Critical Habitats
 Within National Protected Areas","Congo, Democratic Republic of the"
M5 Upgrade (Bobruysk - Zhlobin),2012,$322M,ExImBank,Government,Transport,None Known,Belarus
MA 60 and Y12 air crafts purchase,2016,$35M,ExImBank,Nepal Airline Corporation,Transport,None Known,Nepal
MA60 Chinese Aircrafts Purchase,2013,$71M,ExImBank,Government,Transport,None Known,Cameroon
Mabini LNG hub,2019,$2.0B,CDB,Philippine National Oil Company,Power,None Known,Philippines
Machine Purchases and Training (Tranche 1),2011,$33M,CDB,Government,"Agriculture, food",None Known,Angola
Machine Purchases and Training (Tranche 2),2011,$33M,ExImBank,Government,"Agriculture, food",None Known,Angola
Malabo Power Grid (Phase II),2008,$221M,ExImBank,Government,Power,Within Critical Habitats,Equatorial Guinea
Malange MT/BT Networks (Phase II),2008,$27M,ExImBank,Government,Power,None Known,Angola
Malanje River Dredging,2017,$28M,CDB,Government,Other construction,None Known,Angola
Malanje Road Rehabilitation,2016,$55M,CDB,Government,Transport,None Known,Angola
Malanje Youth House Construction,2017,$38M,CDB,Government,Government,None Known,Angola
Malawi Science and Technology University Construction,2011,$79M,ExImBank,Government,Government,None Known,Malawi
Mali Digital 2020 Project,2018,$164M,ExImBank,Government,Telecom,None Known,Mali
Maluana Data Center Construction,2016,$135M,ExImBank,Government,Telecom,None Known,Mozambique
Manado-Bitung Toll Road,2017,$503M,ExImBank,Government,Transport,"Within Indigenous Peoples' Lands
 Within Critical Habitats",Indonesia
Manquete Farm,2014,$86M,CDB,Government,"Agriculture, food",None Known,Angola
Mansa to Luwingu Road Construction,2013,$176M,CDB,Government,Transport,Within National Protected Areas,Zambia
Mansa to Luwingu Road Construction,2016,$30M,CDB,Government,Transport,Within National Protected Areas,Zambia
Maputo International Airport Renovation (Phase I),2009,$67M,ExImBank,Government,Transport,None Known,Mozambique
Maputo Ring Road Construction,2012,$300M,ExImBank,Government,Transport,None Known,Mozambique
Maputo-Catembe Bridge Construction,2012,$686M,ExImBank,Government,Transport,Within Critical Habitats,Mozambique
Marçal Water Distribution Centre Rehabilitation,2013,$54M,CDB,Government,Government,None Known,Angola
Mattala - Hambantota International Airport Project,2010,$191M,ExImBank,Government,Transport,None Known,Sri Lanka
Maurice Bishop International Airport Upgrade,2017,$66M,ExImBank,Government,Transport,Within Critical Habitats,Grenada
Maya-Maya Airport Construction (Brazzaville),2008,$136M,ExImBank,Government,Transport,None Known,"Congo, Republic of the"
Mbala to Nakonde Road Construction,2013,$196M,ExImBank,Government,Transport,"Within Critical Habitats
 Within National Protected Areas",Zambia
Medical Equipment and Medicine Purchase,2012,$90M,ExImBank,Government,Government,None Known,Zimbabwe
Medupi Coal Power Plant Construction,2018,$900M,CDB,Eskom,Power,None Known,South Africa
"Medupi, Kusile and Ingula Power Stations Construction",2016,$500M,CDB,Eskom,Power,"Within Critical Habitats
 Within National Protected Areas",South Africa
Mekelle Water Supply Project (PEBC portion),2018,$156M,ExImBank,Government,Government,"Within Indigenous Peoples' Lands
 Within Critical Habitats",Ethiopia
Mekin Hydropower Project (15MW),2009,$53M,ExImBank,Government,Power,Within Critical Habitats,Cameroon
Mekong Bridge at Pakbeng,2010,$50M,ExImBank,Government,Transport,"Within Indigenous Peoples' Lands
 Within Critical Habitats",Laos
Memve'ele Hydropower Project (211MW),2012,$541M,ExImBank,Government,Power,Within Critical Habitats,Cameroon
Memvélé Dam Hydropower Transmission Lines,2017,$142M,ExImBank,Government,Power,None Known,Cameroon
Meskere Sq-Bole Road Construction,2011,$70M,ExImBank,Government,Transport,Within Indigenous Peoples' Lands,Ethiopia
Metro Line A rail car purchase,2014,$162M,ExImBank,Buenos Aires local government,Transport,None Known,Argentina
Micomeseng-Bonkoro Highway Construction,2015,$261M,ExImBank,Government,Transport,None Known,Equatorial Guinea
Military Residential Houses Construction,2013,$285M,ExImBank,Government,Government,None Known,Tanzania
Minas-San Francisco Hydroelectric Dam (in Addition to the 2011 CDB loan),2013,$312M,ExImBank,Government,Power,None Known,Ecuador
Ministry of Energy and Water Training Center & Database,2017,$36M,CDB,Government,Telecom,None Known,Angola
Minsk-Severnaya Substation (Renovation),2015,$48M,ExImBank,Government,Power,None Known,Belarus
Mnazi Bay to Dar es Salaam Gas Pipeline Construction,2012,$1.2B,ExImBank,Government,"Extraction, pipelines",None Known,Tanzania
Mobile Hospital Project,2010,$47M,ExImBank,Government,Government,None Known,Zambia
Modjo-Hawassa Expressway Construction (Arsi Negele-Hawassa Section),2017,$171M,ExImBank,Government,Transport,"Within Indigenous Peoples' Lands
 Within Critical Habitats",Ethiopia
Mongu Kalabo Road Rehabilitation (Mongu-Tapo Section),2011,$244M,ExImBank,Government,Transport,"Within Critical Habitats
 Within National Protected Areas",Zambia
Moragahakanda Development Project,2012,$214M,CDB,Government,Power,"Within Critical Habitats
 Within National Protected Areas",Sri Lanka
"Morón, Carabobo port",2013,$391M,ExImBank,"Petróleos de Venezuela, S.A. (PDVSA)",Transport,None Known,Venezuela
Moscow-Kazan high-speed rail,2016,$6.0B,CDB,Government,Transport,"Within Critical Habitats
 Within National Protected Areas",Russian Federation
Moxico Roads Rehabilitation,2017,$235M,CDB,Government,Transport,None Known,Angola
Mozambique presidential palace Project,2013,$72M,ExImBank,Government,Government,Within Critical Habitats,Mozambique
Mpila Business District Development,2014,$62M,ExImBank,Government,Other construction,None Known,"Congo, Republic of the"
Mpila High School Construction,2013,$66M,ExImBank,Government,Government,None Known,"Congo, Republic of the"
Mpila Twin Tower Business Center Construction,2014,$328M,ExImBank,Government,Other construction,None Known,"Congo, Republic of the"
MR67 and DR3602 Road Upgrade,2012,$135M,ExImBank,Government,Transport,"Within Indigenous Peoples' Lands
 Within National Protected Areas",Namibia
Multisector,2008,$50M,CDB,Trade and Development Bank,Mulit-sector/discretionary,None Known,Regional
Multisector projects,2017,$2.2B,CDB,Government,Mulit-sector/discretionary,None Known,Angola
Mwityazo-Ruvumbu-Karongi Road Construction,2012,$113M,ExImBank,Government,Transport,Within Critical Habitats,Rwanda
Myanmar farm equipment and machinery,2015,$400M,ExImBank,Government,"Agriculture, food",None Known,Myanmar
N'Djamena 90kV Ring Transmission Line & N'Djamena - Djarmaya Refinery 60kv Transmission Line,2012,$130M,ExImBank,Government,Mulit-sector/discretionary,Within Indigenous Peoples' Lands,Chad
N'Djamena Oil Refinery Construction,2011,$330M,ExImBank,N'Djamena Refinery Company,Manufacturing,Within Indigenous Peoples' Lands,Chad
N'Djili Airport Runway Refurbishment,2012,$60M,ExImBank,Government,Transport,None Known,"Congo, Democratic Republic of the"
N´Gola Kiluange Road Rehabilitation,2016,$26M,CDB,Government,Transport,Within Critical Habitats,Angola
Nadarivatu Dam,2009,$74M,CDB,Government,Power,Within Critical Habitats,Fiji
"Nagan Raya Thermal Power Plant (Meulaboh Power Station), Special Region of Aceh",2009,$124M,ExImBank,Perusahaan Listrik Negara (PLN),Power,None Known,Indonesia
Nairobi 132KV and 66KV Network Upgrade and Reinforcement,2014,$130M,ExImBank,Government,Power,"Within Critical Habitats
 Within National Protected Areas",Kenya
Nairobi Power Transmission Projects: Embakasi-Nairobi Railways Compound Cable (220 kV); Underground Cables (66kV) ; Substation in Likoni (66/11 kV); Modernize Cathedral Substation,2016,$132M,ExImBank,Government,Power,"Within Critical Habitats
 Within National Protected Areas",Kenya
Nairobi Ring Road Construction,2009,$108M,ExImBank,Government,Transport,None Known,Kenya
Nairobi Southern Bypass Construction,2012,$156M,ExImBank,Government,Transport,"Within Critical Habitats
 Within National Protected Areas",Kenya
Nairobi-Thika Highway Construction,2009,$156M,ExImBank,Government,Transport,Within National Protected Areas,Kenya
Nam Khan 2 Dam,2009,$308M,ExImBank,Government,Power,"Within Indigenous Peoples' Lands
 Within Critical Habitats",Laos
Nam Khan 3 Dam,2012,$127M,ExImBank,Government,Power,Within Indigenous Peoples' Lands,Laos
Nam Ngiep 2 hydropower plant,2011,$345M,CDB,Electicite du Laos (EdL) & China International Water & Electric Corp (CWE),Power,"Within Indigenous Peoples' Lands
 Within Critical Habitats",Laos
Nam Ngum 4a Hydropower Station,2016,$322M,ExImBank,Government,Power,"Within Indigenous Peoples' Lands
 Within Critical Habitats
 Within National Protected Areas",Laos
"Nam Ou hydropower project, phase 1 (Dams 2, 5, 6)",2012,$660M,CDB,Electicite du Laos (EdL) & Sinohydro Joint Venture,Power,"Within Indigenous Peoples' Lands
 Within Critical Habitats",Laos
"Nam Ou hydropower project, phase 2 (Nam Ou 1, 3, 4, 7)",2011,$1000M,CDB,Electicite du Laos (EdL) & Sinohydro Joint Venture,Power,Within Critical Habitats,Laos
Nam Tha 1 Hydro Power Project,2018,$400M,ExImBank,Electicite du Laos (EdL) & China Southern Power Grid (SOE),Power,None Known,Laos
Nassau Airport Gateway Project,2011,$58M,ExImBank,Government,Transport,Within Critical Habitats,Bahamas
National Backbone Fiber Optics Project,2014,$214M,ExImBank,Government,Telecom,None Known,Guinea
National Backbone Transmission (Project II),2011,$67M,ExImBank,Government,Telecom,"Within Critical Habitats
 Within National Protected Areas",Uganda
National Broadband Network Project,2014,$79M,ExImBank,Government,Telecom,None Known,Mali
National Broadband Network Project,2016,$98M,ExImBank,Government,Telecom,None Known,Suriname
National Broadband Project,2015,$82M,ExImBank,Government,Telecom,"Within Indigenous Peoples' Lands
 Within Critical Habitats
 Within National Protected Areas",Senegal
National Defense College Construction,2011,$107M,ExImBank,Government,Government,None Known,Zimbabwe
National Fibre Optic Backbone Expansion,2014,$83M,ExImBank,Government,Telecom,None Known,Cameroon
National Geology Plan Project,2017,$65M,ExImBank,Government,Government,None Known,Angola
National Identification Project,2013,$76M,ExImBank,Government,Government,None Known,Papua New Guinea
National Infrastructure Projects (Dalian IV),2016,$235M,ExImBank,Government,Transport,"Within Indigenous Peoples' Lands
 Within Critical Habitats",Suriname
National Medical Center and Ministry of Health Headquarters,2010,$30M,ExImBank,"MoH, NHS, Shanghai Construction Group",Government,Within Critical Habitats,Samoa
National Medical Centre and Ministry of Health Headquarters,2008,$41M,ExImBank,Government,Government,None Known,Samoa
National Optic Fibre Backbone Infrastructure (Phase II); E-government,2012,$73M,ExImBank,Government,Telecom,"Within Indigenous Peoples' Lands
 Within Critical Habitats",Kenya
National Power Grid Upgrade (Tranche A),2015,$776M,ExImBank,Government,Power,None Known,Cote d'Ivoire
National Public Communication System Construction,2010,$400M,ExImBank,Government,Telecom,None Known,Nigeria
National Road Improvement Program,2010,$43M,ExImBank,Government,Transport,Within Critical Habitats,Tonga
National Road No.3 Construction Project from Phnom Penh (Chom Chao)-Bek Kus-Kampot Town,2018,$215M,ExImBank,Government,Transport,Within Critical Habitats,Cambodia
National Route 1 Rehabilitation (Phase II),2012,$1.2B,ExImBank,Government,Transport,None Known,"Congo, Republic of the"
National Route 2 Rehabilitation (Phase II),2012,$234M,ExImBank,Government,Transport,"Within Indigenous Peoples' Lands
 Within Critical Habitats
 Within National Protected Areas","Congo, Republic of the"
National Route 2; Owando-Makoua-Ouesso Road; Owando-Makoua-Mambili Construction (Phase 1),2009,$303M,ExImBank,Government,Transport,"Within Indigenous Peoples' Lands
 Within Critical Habitats
 Within National Protected Areas","Congo, Republic of the"
National security communication Project,2009,$33M,ExImBank,Government,Government,None Known,Senegal
National security project GoTa (Phase II),2013,$123M,ExImBank,Government,Government,None Known,Ghana
National Telecom Broadband Network Project (Phase II),2015,$328M,ExImBank,Camtel,Telecom,Within Indigenous Peoples' Lands,Cameroon
National Telecom Project (Phase III),2017,$161M,ExImBank,Government,Telecom,None Known,"Congo, Republic of the"
Navy Patrol Vessels Purchase (P108 and P109),2012,$330M,ExImBank,Government,Government,None Known,Cameroon
NCDC Road upgrade,2018,$110M,ExImBank,Government,Transport,Within Critical Habitats,Papua New Guinea
Ndola International Airport (Phase I),2016,$338M,ExImBank,Government,Transport,None Known,Zambia
Neelum-Jhelum Hydro Station,2015,$576M,ExImBank,Government,Power,"Within Indigenous Peoples' Lands
 Within Critical Habitats",Pakistan
Neelum-Jhelum Hydro Station,2012,$448M,ExImBank,Government,Power,"Within Indigenous Peoples' Lands
 Within Critical Habitats",Pakistan
NetOne Telecom Network Expansion (Phase II),2014,$219M,ExImBank,NetOne,Telecom,None Known,Zimbabwe
NetOne Telecome Network Expansion (Phase I),2010,$48M,ExImBank,NetOne,Telecom,None Known,Zimbabwe
New Dehydration and Desalination Plant; expansion of Jose Processing Plant in Anzoategui,2016,$2.2B,CDB,"Petróleos de Venezuela, S.A. (PDVSA)",Mulit-sector/discretionary,None Known,Venezuela
New Juba International Airport Project,2014,$158M,ExImBank,Government,Transport,Within National Protected Areas,South Sudan
New Khartoum International Airport Construction,2014,$700M,ExImBank,Government,Transport,None Known,Sudan
New Lome International Airport (CL portion),2012,$75M,ExImBank,Government,Transport,None Known,Togo
New Lome International Airport (EBC portion),2012,$75M,ExImBank,Government,Transport,None Known,Togo
New Sukala Sugar Refinery Construction,2008,$29M,ExImBank,N-Sukala,"Agriculture, food",Within Indigenous Peoples' Lands,Mali
Niamtougou Airport Redevelopment,2016,$44M,ExImBank,Government,Transport,Within Indigenous Peoples' Lands,Togo
Non-intrusive container scanning equipment Purchase,2009,$46M,ExImBank,Government,Government,None Known,Zambia
Norochcholai (Lakvijaya) Power Plant Phase 2,2009,$891M,ExImBank,Ceylon Electricity Board,Power,None Known,Sri Lanka
North-South Transport Corridor (Phase 1),2014,$400M,ExImBank,Government,Transport,None Known,Kyrgyz Republic
North-South Transport Corridor (Phase 2),2015,$185M,ExImBank,Government,Transport,Within National Protected Areas,Kyrgyz Republic
North/South toll highway construction,2013,$457M,ExImBank,Government,Transport,"Within Critical Habitats
 Within National Protected Areas",Jamaica
Northern Road Rehabilitation Project,2010,$302M,ExImBank,Government,Transport,None Known,Sri Lanka
Nouakchott Friendship Port Expansion,2009,$293M,ExImBank,Government,Transport,Within Critical Habitats,Mauritania
Nyala Water Supply Project,2008,$51M,ExImBank,Government,Government,None Known,Sudan
Nzeto-Soyo Road Construction,2015,$509M,ExImBank,Government,Transport,Within Critical Habitats,Angola
Obrenovac-Uba and Lajkovac-Ljig Road projects,2014,$334M,ExImBank,Government,Transport,None Known,Serbia
Oil - related,2010,$200M,CDB,Petroecuador,Power,None Known,Ecuador
OIl - related,2011,$600M,CDB,Petroecuador,Power,None Known,Ecuador
Oil Exploration,2015,$1.5B,CDB,"Petrobras, Netherland sub-company","Extraction, pipelines",None Known,Brazil
Oil Export,2015,$3.5B,CDB,Petrobras,"Extraction, pipelines",None Known,Brazil
Oil Export,2009,$15.0B,CDB,Rosneft,"Extraction, pipelines",None Known,Russian Federation
Oil refinery,2010,$1.1B,CDB,"Petróleos de Venezuela, S.A. (PDVSA)",Manufacturing,None Known,Venezuela
"Oil Tanker Mooring Platform, Underwater and Onshore Pipeline",2017,$694M,ExImBank,Government,"Extraction, pipelines",None Known,Bangladesh
Olkaria IV Drilling Geothermal Stream,2012,$383M,ExImBank,Government,Power,"Within Critical Habitats
 Within National Protected Areas",Kenya
Olkaria IV geothermal- 26 wells (140MW),2010,$102M,ExImBank,Government,Power,"Within Critical Habitats
 Within National Protected Areas",Kenya
Olkaria V Geothermal Drilling,2012,$484M,ExImBank,Kenya Electricity Generating Company (KenGen),Power,"Within Critical Habitats
 Within National Protected Areas",Kenya
Omo-Quraz Sugar Factory 2 Construction,2013,$290M,CDB,Ethiopia Sugar Corporation,"Agriculture, food","Within Indigenous Peoples' Lands
 Within National Protected Areas",Ethiopia
Omo-Quraz Sugar Factory 3 Construction,2013,$290M,CDB,Ethiopia Sugar Corporation,"Agriculture, food","Within Indigenous Peoples' Lands
 Within National Protected Areas",Ethiopia
Orange Line Metro Train Project,2014,$1.6B,ExImBank,Government,Transport,None Known,Pakistan
Orinoco oil production,2011,$4.0B,CDB,"The Venezuelan Economic and Social Development Bank (BANDES) and Petróleos de Venezuela, S.A. (PDVSA)","Extraction, pipelines","Within Indigenous Peoples' Lands
 Within Critical Habitats
 Within National Protected Areas",Venezuela
Osh-Batken-Isfana Road Rehabilitation,2011,$91M,ExImBank,Government,Transport,None Known,Kyrgyz Republic
Osh-Irkeshtam road Construction,2008,$75M,ExImBank,Government,Transport,Within Critical Habitats,Kyrgyz Republic
Oyala (Djibloho) New Capital and Social Housing Construction: 10 Administrative Buildings; Social Housing-500 Units ; 1200 Units of Presidential Palace Administrative Districts,2017,$510M,ExImBank,Government,Other construction,None Known,Equatorial Guinea
Oyo Harbour Construction,2013,$55M,ExImBank,Government,Transport,Within Critical Habitats,"Congo, Republic of the"
Pacific Marine Industrial Zone,2011,$156M,ExImBank,China Shenyang International Economic Corporation Limited (CSYIEC)/ Department of Commerce & Industry/National Fisheries Authority/ Madang Provincial Govt.,"Agriculture, food",Within Critical Habitats,Papua New Guinea
Pacitan Coal Power Plant,2009,$293M,ExImBank,Perusahaan Listrik Negara (PLN),Power,None Known,Indonesia
Padma water treatment plant,2012,$291M,ExImBank,Government,Government,None Known,Bangladesh
Paiton Power Plant Unit 9,2008,$330M,ExImBank,Perusahaan Listrik Negara (PLN),Power,Within Indigenous Peoples' Lands,Indonesia
Pak Lay Dam,2017,$90M,ExImBank,Government,Power,Within Critical Habitats,Laos
Pakistan-China Cross-border Fiber Optic Cable,2013,$44M,ExImBank,Government,Telecom,"Within Indigenous Peoples' Lands
 Within National Protected Areas",Pakistan
Paksat-1R Satellite,2008,$200M,ExImBank,Government,Telecom,None Known,Pakistan
Palisadoes Peninsula repair,2010,$58M,ExImBank,Government,Government,"Within Critical Habitats
 Within National Protected Areas",Jamaica
Pangkalan Susu Power Plant Phase I Unit II,2014,$373M,ExImBank,Perusahaan Listrik Negara (PLN),Power,None Known,Indonesia
Pangkalan Susu Power Plant Phase II Unit I,2014,$373M,ExImBank,Perusahaan Listrik Negara (PLN),Power,Within Critical Habitats,Indonesia
Pangkalan Susu Power Plant Phase II Unit II,2014,$373M,ExImBank,Perusahaan Listrik Negara (PLN),Power,None Known,Indonesia
Pangkalan Susu Unit 3 & 4 Coal Fired Power Plant,2013,$317M,ExImBank,Indonesian State Electricity Company,Power,Within Critical Habitats,Indonesia
Pap-Angren Railway,2015,$350M,ExImBank,Government,Transport,Within Critical Habitats,Uzbekistan
Parit Baru Power Station,2011,$133M,ExImBank,Government,Power,None Known,Indonesia
Payra 1320 (2x660) MW Thermal Power Plant Project (Kalapara Phase I),2016,$1.6B,ExImBank,Bangladesh-China Power Company Limited,Power,None Known,Bangladesh
"PDVSA, credit to buy 40% share of Abreu e Lima from Petrobras",2013,$1.5B,CDB,"Petróleos de Venezuela, S.A. (PDVSA)","Extraction, pipelines",None Known,Venezuela
Pedras Negras Farm,2011,$117M,CDB,Government,"Agriculture, food",None Known,Angola
Pelabuhan Ratu Power Station,2009,$481M,ExImBank,Perusahaan Listrik Negara (PLN),Power,None Known,Indonesia
Peshawar-Karachi Motorway (PKM) Project,2016,$2.9B,ExImBank,Government,Transport,"Within Indigenous Peoples' Lands
 Within Critical Habitats",Pakistan
Phnom Penh Loop Line Phase 2,2013,$76M,ExImBank,Government,Power,Within Critical Habitats,Cambodia
Phoenix Park Industrial Estate,2019,$104M,ExImBank,Government,Mulit-sector/discretionary,None Known,Trinidad and Tobago
Pipeline Project to Carry Crude Oil,2015,$509M,ExImBank,Government,"Extraction, pipelines",None Known,Bangladesh
PLTU Nangroe Aceh Darussalam Thermal Power Plant,2009,$124M,ExImBank,Perusahaan Listrik Negara (PLN),Power,None Known,Indonesia
Pokhara International Airport,2016,$216M,ExImBank,Government,Transport,"Within Indigenous Peoples' Lands
 Within Critical Habitats",Nepal
Polypropylene plant in Atyrau,2011,$1.1B,ExImBank,Government,Manufacturing,None Known,Kazakhstan
Polytechnics Upgrade; Technical and Vocational Training Centers,2018,$119M,ExImBank,Government,Government,None Known,Ghana
Post-earthquake reconstruction,2018,$69M,ExImBank,Government,Other construction,None Known,Ecuador
Potable Water Project,2012,$50M,ExImBank,Government,Government,Within Indigenous Peoples' Lands,Niger
Potable Water Supply (Phase II),2018,$86M,ExImBank,Government,Government,None Known,Cameroon
Potable Water Supply Projects (Phase I),2013,$174M,ExImBank,Government,Government,None Known,Cameroon
"Preferential Supply Contract with Unipec Asia Company, Loan Disbursed Dec 2017-Jan 2018",2017,$5.0B,CDB,Petrobras,"Extraction, pipelines",None Known,Brazil
Presidente Médici Candiota Power Station (Third Expansion),2008,$356M,CDB,Government,Power,Within Critical Habitats,Brazil
Private Sector Activities in the UEMOA Member States,2015,$109M,CDB,Banque Ouest Africaine,Government,None Known,Regional
Private Sector Lending UEMOA Member States,2014,$125M,CDB,Banque Ouest Africaine,Government,None Known,Regional
Procurement of Material for Lighting Sri Lanka - Uva Province,2011,$33M,ExImBank,Government,Power,None Known,Sri Lanka
Procurement of Power Lines Material (Loan 2),2008,$57M,ExImBank,Government,Power,None Known,Kenya
Procurement of Three Oil Tankers and Three Bulk Carriers,2015,$185M,ExImBank,Government,Transport,None Known,Bangladesh
Procurement of Vehicles for Police Force,2015,$39M,ExImBank,Government,Government,None Known,Myanmar
Public Security Network III Project,2016,$179M,CDB,Government,Government,None Known,Zambia
Public Solar Street Lamp Project,2014,$55M,ExImBank,Government,Power,None Known,Togo
Purchase of Agricultural Projects,2012,$3.0B,ExImBank,Government,"Agriculture, food",None Known,Ukraine
Purchase of Bulk Cargo Ships,2010,$47M,ExImBank,Government,Transport,None Known,Montenegro
Purchase of freight locomotives,2011,$42M,ExImBank,Government,Transport,None Known,Uzbekistan
PVC plant construction,2014,$300M,ExImBank,Government,Manufacturing,None Known,Uzbekistan
Qamchiq Tunnel (Angren-Pap Railway Line),2013,$350M,ExImBank,Government,Transport,Within Critical Habitats,Uzbekistan
Quang Ninh-1 Unit 1,2009,$176M,ExImBank,Government,Power,"Within Indigenous Peoples' Lands
 Within Critical Habitats",Vietnam
Rabai-Malindi-Garsen-Lamu Transmission Line,2010,$93M,ExImBank,Government,Power,None Known,Kenya
